Position,Organic Position,Searchquery,Device,Title,Description,Pixeldistance from top,Snippet Pixel Height,URL,domain,Sitename,URL Preview,Custom Favicon,Title truncated,Description truncated,Has sitelinks,Has rich results,Has image,location,date,time
84,82,"“universitas kristen maranatha” OR ""universitas maranatha"" OR ""uk maranatha"" -site:*.maranatha.edu -site:kemdikbud.go.id -site:linkedin.com -site:twitter.com -site:instagram.com -site:lldikti4.or.id -site:facebook.com -site:tiktok.com -site:olx.co.id -site:slideshare.net -site:rumah123.com -site:tiket.com -site:expedia.co.id -site:traveloka.com -site:wikipedia.org -intitle:hotel",desktop,"Entaskan Kemiskinan, Ganjar Programkan Satu Keluarga ...","Oct 11, 2023 — Hal itu disampaikan Ganjar di hadapan ribuan mahasiswa ketika memberikan kuliah umum di Universitas Kristen Maranatha Bandung, Rabu (11/10). Dalam ...",13402,117,https://rm.id/baca-berita/nasional/192166/entaskan-kemiskinan-ganjar-programkan-satu-keluarga-miskin-satu-sarjana,rm.id,rm.id,https://rm.id › baca-berita › nasional,yes,TRUE,TRUE,FALSE,FALSE,FALSE,"Indonesia Sukasari, Bandung City, West Java",11/3/2023,14:06
85,83,"“universitas kristen maranatha” OR ""universitas maranatha"" OR ""uk maranatha"" -site:*.maranatha.edu -site:kemdikbud.go.id -site:linkedin.com -site:twitter.com -site:instagram.com -site:lldikti4.or.id -site:facebook.com -site:tiktok.com -site:olx.co.id -site:slideshare.net -site:rumah123.com -site:tiket.com -site:expedia.co.id -site:traveloka.com -site:wikipedia.org -intitle:hotel",desktop,Kost Gratia Maranatha Sukajadi Bandung,"Oct 15, 2023 — Kost khusus mahasiswa/mahasiswi Universitas Maranatha Bandung. Lokasi sangat strategis di jalan besar Surya Sumantri seberang Universitas Maranatha. Tempat ...",13549,117,https://mamikos.com/room/kost-kota-bandung-kost-campur-eksklusif-kost-gratia-maranatha-sukajadi-bandung,mamikos.com,mamikos.com,https://mamikos.com › room › kost-...,yes,FALSE,TRUE,FALSE,FALSE,FALSE,"Indonesia Sukasari, Bandung City, West Java",11/3/2023,14:06
86,84,"“universitas kristen maranatha” OR ""universitas maranatha"" OR ""uk maranatha"" -site:*.maranatha.edu -site:kemdikbud.go.id -site:linkedin.com -site:twitter.com -site:instagram.com -site:lldikti4.or.id -site:facebook.com -site:tiktok.com -site:olx.co.id -site:slideshare.net -site:rumah123.com -site:tiket.com -site:expedia.co.id -site:traveloka.com -site:wikipedia.org -intitle:hotel",desktop,Kejadian unik terjadi saat Capres Ganjar Pranowo ...,"Oct 14, 2023 — ... Universitas Kristen Maranatha, Bandung, Rabu (11/10/2023) dimana ada seorang ... Universitas Maranatha Bandung · Ganjar Pranowo. Konten Promosi. Lorem ipsum ...",13696,117,https://www.bpkpnews.com/nasional/31310506302/kejadian-unik-terjadi-saat-capres-ganjar-pranowo-berkunjung-ke-kampus-maranata-kota-bandung,www.bpkpnews.com,bpkpnews.com,https://www.bpkpnews.com › kejadi...,yes,TRUE,TRUE,FALSE,FALSE,FALSE,"Indonesia Sukasari, Bandung City, West Java",11/3/2023,14:06
87,85,"“universitas kristen maranatha” OR ""universitas maranatha"" OR ""uk maranatha"" -site:*.maranatha.edu -site:kemdikbud.go.id -site:linkedin.com -site:twitter.com -site:instagram.com -site:lldikti4.or.id -site:facebook.com -site:tiktok.com -site:olx.co.id -site:slideshare.net -site:rumah123.com -site:tiket.com -site:expedia.co.id -site:traveloka.com -site:wikipedia.org -intitle:hotel",desktop,"dr. Ardi Soeharta Chandra, Sp.K.F.R., AIFO-K","5 days ago — Program Profesi Dokter, Fakultas Kedokteran Universitas Kristen Maranatha Bandung (2010-2016); Program Pendidikan Dokter Spesialis Ilmu Kedokteran Fisik dan ...",13842,117,https://www.rsprimapekanbaru.com/list-dokter/dr-ardi-soeharta-chandra-sp-k-f-r-aifo-k,www.rsprimapekanbaru.com,rsprimapekanbaru.com,https://www.rsprimapekanbaru.com › ...,yes,FALSE,TRUE,FALSE,FALSE,FALSE,"Indonesia Sukasari, Bandung City, West Java",11/3/2023,14:06
88,86,"“universitas kristen maranatha” OR ""universitas maranatha"" OR ""uk maranatha"" -site:*.maranatha.edu -site:kemdikbud.go.id -site:linkedin.com -site:twitter.com -site:instagram.com -site:lldikti4.or.id -site:facebook.com -site:tiktok.com -site:olx.co.id -site:slideshare.net -site:rumah123.com -site:tiket.com -site:expedia.co.id -site:traveloka.com -site:wikipedia.org -intitle:hotel",desktop,Laman 764 – Info Harga Terbaru,"Oct 2, 2023 — Pendaftaran & Biaya Kuliah Universitas Kristen Maranatha TA 2023/2024. Universitas Kristen Maranatha merupakan sebuah perguruan tinggi swasta yang berlokasi ...",13989,117,https://harga.web.id/page/764,harga.web.id,harga.web.id,https://harga.web.id › page,yes,FALSE,TRUE,FALSE,FALSE,FALSE,"Indonesia Sukasari, Bandung City, West Java",11/3/2023,14:06
89,87,"“universitas kristen maranatha” OR ""universitas maranatha"" OR ""uk maranatha"" -site:*.maranatha.edu -site:kemdikbud.go.id -site:linkedin.com -site:twitter.com -site:instagram.com -site:lldikti4.or.id -site:facebook.com -site:tiktok.com -site:olx.co.id -site:slideshare.net -site:rumah123.com -site:tiket.com -site:expedia.co.id -site:traveloka.com -site:wikipedia.org -intitle:hotel",desktop,LSP Mode Indonesia,"2 days ago — Universitas Kristen Maranatha, Jl. Surya Sumantri No.65, Sukawarna, Kec. Sukajadi, Kota Bandung, Jawa Barat 40164. 13, TUK Mode 14, Sewaktu, Universitas Negeri ...",14136,117,https://bnsp.go.id/detaillsp.php?id=3785,bnsp.go.id,bnsp.go.id,https://bnsp.go.id › detaillsp,yes,FALSE,TRUE,FALSE,FALSE,FALSE,"Indonesia Sukasari, Bandung City, West Java",11/3/2023,14:06
90,88,"“universitas kristen maranatha” OR ""universitas maranatha"" OR ""uk maranatha"" -site:*.maranatha.edu -site:kemdikbud.go.id -site:linkedin.com -site:twitter.com -site:instagram.com -site:lldikti4.or.id -site:facebook.com -site:tiktok.com -site:olx.co.id -site:slideshare.net -site:rumah123.com -site:tiket.com -site:expedia.co.id -site:traveloka.com -site:wikipedia.org -intitle:hotel",desktop,"Potret Cantik Vissi El Alexandra, Profil Biodata Dokter Gigi ...","Oct 24, 2023 — Ia bekerja di salah satu klinik gigi di Ruko Paskal 23, Jalan Pasir Kaliki, Kota Bandung, setelah menyelesaikan pendidikan di Universitas Kristen Maranatha.",14283,117,https://www.mengerti.id/sosok/66410618032/potret-cantik-vissi-el-alexandra-profil-biodata-dokter-gigi-bandung-jadi-korban-penganiayaan-samuel-sunarya?page=2,www.mengerti.id,mengerti.id,https://www.mengerti.id › Sosok,yes,TRUE,FALSE,FALSE,FALSE,FALSE,"Indonesia Sukasari, Bandung City, West Java",11/3/2023,14:06
91,89,"“universitas kristen maranatha” OR ""universitas maranatha"" OR ""uk maranatha"" -site:*.maranatha.edu -site:kemdikbud.go.id -site:linkedin.com -site:twitter.com -site:instagram.com -site:lldikti4.or.id -site:facebook.com -site:tiktok.com -site:olx.co.id -site:slideshare.net -site:rumah123.com -site:tiket.com -site:expedia.co.id -site:traveloka.com -site:wikipedia.org -intitle:hotel",desktop,"Cegah Stunting, Gerakkan Aksi Satu keluarga Satu Kelor","Oct 20, 2023 — BANDUNG (stunting.go.id)- Dosen Fakultas Kedokteran Universitas Maranatha Bandung dr. Theresia Monica Rahardjo meluncurkan buku yang membeberkan manfaat ...",14460,117,https://stunting.go.id/cegah-stunting-gerakkan-aksi-satu-keluarga-satu-kelor/,stunting.go.id,stunting.go.id,https://stunting.go.id › cegah-stunti...,yes,FALSE,TRUE,FALSE,FALSE,FALSE,"Indonesia Sukasari, Bandung City, West Java",11/3/2023,14:06
92,90,"“universitas kristen maranatha” OR ""universitas maranatha"" OR ""uk maranatha"" -site:*.maranatha.edu -site:kemdikbud.go.id -site:linkedin.com -site:twitter.com -site:instagram.com -site:lldikti4.or.id -site:facebook.com -site:tiktok.com -site:olx.co.id -site:slideshare.net -site:rumah123.com -site:tiket.com -site:expedia.co.id -site:traveloka.com -site:wikipedia.org -intitle:hotel",desktop,Ganjar Pranowo: Pendidikan Jadi Kunci Pemberantasan ...,"Oct 12, 2023 — Hal itu disampaikan Ganjar di hadapan ribuan mahasiswa ketika memberikan kuliah umum di Kampus Universitas Kristen Maranatha Bandung, Jawa Barat. “Saya ...",14607,117,https://pdiperjuangan-jatim.com/ganjar-pranowo-pendidikan-jadi-kunci-pemberantasan-kemiskinan/,pdiperjuangan-jatim.com,pdiperjuangan-jatim.com,https://pdiperjuangan-jatim.com › g...,yes,TRUE,TRUE,FALSE,FALSE,FALSE,"Indonesia Sukasari, Bandung City, West Java",11/3/2023,14:06
93,91,"“universitas kristen maranatha” OR ""universitas maranatha"" OR ""uk maranatha"" -site:*.maranatha.edu -site:kemdikbud.go.id -site:linkedin.com -site:twitter.com -site:instagram.com -site:lldikti4.or.id -site:facebook.com -site:tiktok.com -site:olx.co.id -site:slideshare.net -site:rumah123.com -site:tiket.com -site:expedia.co.id -site:traveloka.com -site:wikipedia.org -intitle:hotel",desktop,Gagasan Ganjar Pranowo Berantas Kemiskinan di Indonesia,"Oct 12, 2023 — Dia akan menjadi penolong upah tulang punggung keluarganya,' kata Ganjar, saat mengisi kuliah umum di Universitas Kristen Maranatha, Bandung, Jawa Barat ...",14753,117,https://www.jurnas.com/artikel/144779/Gagasan-Ganjar-Pranowo-Berantas-Kemiskinan-di-Indonesia/,www.jurnas.com,jurnas.com,https://www.jurnas.com › artikel,yes,FALSE,TRUE,FALSE,FALSE,FALSE,"Indonesia Sukasari, Bandung City, West Java",11/3/2023,14:06
94,92,"“universitas kristen maranatha” OR ""universitas maranatha"" OR ""uk maranatha"" -site:*.maranatha.edu -site:kemdikbud.go.id -site:linkedin.com -site:twitter.com -site:instagram.com -site:lldikti4.or.id -site:facebook.com -site:tiktok.com -site:olx.co.id -site:slideshare.net -site:rumah123.com -site:tiket.com -site:expedia.co.id -site:traveloka.com -site:wikipedia.org -intitle:hotel",desktop,Ganjar Gagas Program Satu Keluarga Miskin Satu Sarjana,"Oct 12, 2023 — Hal itu disampaikan Ganjar di hadapan ribuan mahasiswa ketika memberikan kuliah umum di Kampus Universitas Kristen Maranatha Bandung, Jawa Barat. 'Saya ...",14900,117,https://koran-jakarta.com/ganjar-gagas-program-satu-keluarga-miskin-satu-sarjana,koran-jakarta.com,koran-jakarta.com,https://koran-jakarta.com › ganjar-g...,yes,FALSE,TRUE,FALSE,FALSE,FALSE,"Indonesia Sukasari, Bandung City, West Java",11/3/2023,14:06
95,93,"“universitas kristen maranatha” OR ""universitas maranatha"" OR ""uk maranatha"" -site:*.maranatha.edu -site:kemdikbud.go.id -site:linkedin.com -site:twitter.com -site:instagram.com -site:lldikti4.or.id -site:facebook.com -site:tiktok.com -site:olx.co.id -site:slideshare.net -site:rumah123.com -site:tiket.com -site:expedia.co.id -site:traveloka.com -site:wikipedia.org -intitle:hotel",desktop,Hebat… Kodiklatal Raih 9 Medali Kejuaraan Taekwondo ...,"Oct 11, 2023 — Alumni Universitas Kristen Maranatha Bandung, Jurusan Psikologi ini juga mengatakan, 'Kami bertanding nothing to lose dan berusaha semaksimal mungkin serta ...",15047,117,https://tni.mil.id/view-232056-hebat-kodiklatal-raih-9-medali-kejuaraan-taekwondo-kasal-cup-2023.html,tni.mil.id,tni.mil.id,https://tni.mil.id › view-232056-heb...,yes,TRUE,TRUE,FALSE,FALSE,FALSE,"Indonesia Sukasari, Bandung City, West Java",11/3/2023,14:06
96,94,"“universitas kristen maranatha” OR ""universitas maranatha"" OR ""uk maranatha"" -site:*.maranatha.edu -site:kemdikbud.go.id -site:linkedin.com -site:twitter.com -site:instagram.com -site:lldikti4.or.id -site:facebook.com -site:tiktok.com -site:olx.co.id -site:slideshare.net -site:rumah123.com -site:tiket.com -site:expedia.co.id -site:traveloka.com -site:wikipedia.org -intitle:hotel",desktop,"Momen Mahasiswi Cuekin Ganjar Pranowo, Tetap Asyik ...","Oct 14, 2023 — BANDUNG, suaramerdeka.com – Ada momen menarik saat Ganjar Pranowo berkunjung ke Universitas Kristen Maranatha Bandung, Jawa Barat. Dalam sebuah video yang ...",15194,117,https://www.suaramerdeka.com/nasional/0410503214/momen-mahasiswi-cuekin-ganjar-pranowo-tetap-asyik-makan-walau-semeja-netizen-yang-penting-kenyang,www.suaramerdeka.com,suaramerdeka.com,https://www.suaramerdeka.com › m...,yes,TRUE,TRUE,FALSE,FALSE,FALSE,"Indonesia Sukasari, Bandung City, West Java",11/3/2023,14:06
97,95,"“universitas kristen maranatha” OR ""universitas maranatha"" OR ""uk maranatha"" -site:*.maranatha.edu -site:kemdikbud.go.id -site:linkedin.com -site:twitter.com -site:instagram.com -site:lldikti4.or.id -site:facebook.com -site:tiktok.com -site:olx.co.id -site:slideshare.net -site:rumah123.com -site:tiket.com -site:expedia.co.id -site:traveloka.com -site:wikipedia.org -intitle:hotel",desktop,"Entaskan Kemiskinan, Ganjar Programkan Satu Keluarga ...","Oct 12, 2023 — Hal itu disampaikan Ganjar di hadapan ribuan mahasiswa ketika memberikan kuliah umum di Universitas Kristen Maranatha Bandung, Rabu (11/10). Dalam ...",15340,117,https://mediaindonesia.com/ekonomi/620777/entaskan-kemiskinan-ganjar-programkan-satu-keluarga-miskin-satu-sarjana,mediaindonesia.com,mediaindonesia.com,https://mediaindonesia.com › entask...,yes,TRUE,TRUE,FALSE,FALSE,FALSE,"Indonesia Sukasari, Bandung City, West Java",11/3/2023,14:06
98,96,"“universitas kristen maranatha” OR ""universitas maranatha"" OR ""uk maranatha"" -site:*.maranatha.edu -site:kemdikbud.go.id -site:linkedin.com -site:twitter.com -site:instagram.com -site:lldikti4.or.id -site:facebook.com -site:tiktok.com -site:olx.co.id -site:slideshare.net -site:rumah123.com -site:tiket.com -site:expedia.co.id -site:traveloka.com -site:wikipedia.org -intitle:hotel",desktop,"Entaskan Kemiskinan, Ganjar Programkan Satu Keluarga ...","Oct 12, 2023 — Ganjar di hadapan ribuan mahasiswa ketika memberikan kuliah umum di Universitas Kristen Maranatha Bandung, Rabu (11/10/2023). - (infojateng.id). Penulis ...",15487,117,https://infojateng.id/read/41902/entaskan-kemiskinan-ganjar-programkan-satu-keluarga-miskin-satu-sarjana/,infojateng.id,infojateng.id,https://infojateng.id › read › entaska...,yes,TRUE,TRUE,FALSE,FALSE,FALSE,"Indonesia Sukasari, Bandung City, West Java",11/3/2023,14:06
99,97,"“universitas kristen maranatha” OR ""universitas maranatha"" OR ""uk maranatha"" -site:*.maranatha.edu -site:kemdikbud.go.id -site:linkedin.com -site:twitter.com -site:instagram.com -site:lldikti4.or.id -site:facebook.com -site:tiktok.com -site:olx.co.id -site:slideshare.net -site:rumah123.com -site:tiket.com -site:expedia.co.id -site:traveloka.com -site:wikipedia.org -intitle:hotel",desktop,The Razidence Pasteur Bandung - Kost Campur Free ...,"Oct 20, 2023 — Kost Pasteur ini cuma berjarak 1 menit dar Universitas Kristen Maranatha, sementara ITB, UNPAD Dipatiukur, maupun Politeknik Kesehatan Kemenkes Bandung bisa ...",15634,117,https://www.rukita.co/place/the-razidence-setrasari-bandung,www.rukita.co,rukita.co,https://www.rukita.co › place › the-...,yes,TRUE,TRUE,FALSE,FALSE,FALSE,"Indonesia Sukasari, Bandung City, West Java",11/3/2023,14:06
100,98,"“universitas kristen maranatha” OR ""universitas maranatha"" OR ""uk maranatha"" -site:*.maranatha.edu -site:kemdikbud.go.id -site:linkedin.com -site:twitter.com -site:instagram.com -site:lldikti4.or.id -site:facebook.com -site:tiktok.com -site:olx.co.id -site:slideshare.net -site:rumah123.com -site:tiket.com -site:expedia.co.id -site:traveloka.com -site:wikipedia.org -intitle:hotel",desktop,NUNI IT Online Seminar Phase #5: How Information ...,"Oct 6, 2023 — ... Universitas Kristen Maranatha, Universitas Muhammadiyah Malang, dan Universitas Surabaya dengan tema besar yaitu How Information Technology Shape Our Future.",15781,117,https://nuni.mobi/2023/10/06/nuni-it-online-seminar-phase-5-how-information-technology-shape-our-future-2/,nuni.mobi,nuni.mobi,https://nuni.mobi › 2023/10/06 › n...,yes,TRUE,TRUE,FALSE,FALSE,FALSE,"Indonesia Sukasari, Bandung City, West Java",11/3/2023,14:06
101,99,"“universitas kristen maranatha” OR ""universitas maranatha"" OR ""uk maranatha"" -site:*.maranatha.edu -site:kemdikbud.go.id -site:linkedin.com -site:twitter.com -site:instagram.com -site:lldikti4.or.id -site:facebook.com -site:tiktok.com -site:olx.co.id -site:slideshare.net -site:rumah123.com -site:tiket.com -site:expedia.co.id -site:traveloka.com -site:wikipedia.org -intitle:hotel",desktop,Fasilitas Kota Baru Parahyangan,"Oct 4, 2023 — Fasilitas Sangat Lengkap di Kota Baru Parahyangan. ; Sundial Puspa Iptek ; Taman Tematik Di Setiap Tatar ; Universitas Maranatha ; Universitas Santo Borromeus.",15958,117,https://www.kotabaruparahyangan.id/fasilitas-kota-baru-parahyangan/,www.kotabaruparahyangan.id,kotabaruparahyangan.id,https://www.kotabaruparahyangan.id › ...,no,FALSE,FALSE,FALSE,FALSE,FALSE,"Indonesia Sukasari, Bandung City, West Java",11/3/2023,14:06
102,100,"“universitas kristen maranatha” OR ""universitas maranatha"" OR ""uk maranatha"" -site:*.maranatha.edu -site:kemdikbud.go.id -site:linkedin.com -site:twitter.com -site:instagram.com -site:lldikti4.or.id -site:facebook.com -site:tiktok.com -site:olx.co.id -site:slideshare.net -site:rumah123.com -site:tiket.com -site:expedia.co.id -site:traveloka.com -site:wikipedia.org -intitle:hotel",desktop,JAUR (Journal of Architecture and Urbanism Research),4 days ago — Universitas Kristen Maranatha. Tujuan penelitian ini untuk mengetahui penerapan prinsip pembangunan berkelanjutan pada bangunan indekos Home Sweet Home ...,16105,117,https://www.ojs.uma.ac.id/index.php/jaur/article/download/8647/5243/44855,www.ojs.uma.ac.id,uma.ac.id,https://www.ojs.uma.ac.id › article › download,yes,FALSE,TRUE,FALSE,FALSE,FALSE,"Indonesia Sukasari, Bandung City, West Java",11/3/2023,14:06
103,101,"“universitas kristen maranatha” OR ""universitas maranatha"" OR ""uk maranatha"" -site:*.maranatha.edu -site:kemdikbud.go.id -site:linkedin.com -site:twitter.com -site:instagram.com -site:lldikti4.or.id -site:facebook.com -site:tiktok.com -site:olx.co.id -site:slideshare.net -site:rumah123.com -site:tiket.com -site:expedia.co.id -site:traveloka.com -site:wikipedia.org -intitle:hotel",desktop,Ganjar Ingin Bikin Program Satu Keluarga Miskin ...,"Oct 12, 2023 — Hal itu Ganjar sampaikan saat mengisi kuliah umum di Universitas Kristen Maranatha Bandung, Jawa Barat pada Rabu (11/10/2023). 'Kita ingin mendorong satu ...",16251,117,https://www.idntimes.com/news/indonesia/muhammad-ilman-nafian-2/ganjar-ingin-bikin-program-satu-keluarga-miskin-satu-sarjana,www.idntimes.com,idntimes.com,https://www.idntimes.com › indonesia,yes,TRUE,TRUE,FALSE,FALSE,FALSE,"Indonesia Sukasari, Bandung City, West Java",11/3/2023,14:06
104,102,"“universitas kristen maranatha” OR ""universitas maranatha"" OR ""uk maranatha"" -site:*.maranatha.edu -site:kemdikbud.go.id -site:linkedin.com -site:twitter.com -site:instagram.com -site:lldikti4.or.id -site:facebook.com -site:tiktok.com -site:olx.co.id -site:slideshare.net -site:rumah123.com -site:tiket.com -site:expedia.co.id -site:traveloka.com -site:wikipedia.org -intitle:hotel",desktop,Perancangan Program Penjualan Cctv Secara Tunai Surya ...,"by A Dulu — Bandung: Universitas Kristen Maranatha. Vol. 6. No. 2, September. Adi, Nugroho (2011). Perancangan dan Implementasi sistem basic data. Yogyakarta: Andi. Alam ...",16398,117,https://repository.bsi.ac.id/repo/3044/Perancangan-Program-Penjualan-Cctv-Secara-Tunai-Surya-Elektronik-Jakarta,repository.bsi.ac.id,bsi.ac.id,https://repository.bsi.ac.id › repo,yes,TRUE,TRUE,FALSE,FALSE,FALSE,"Indonesia Sukasari, Bandung City, West Java",11/3/2023,14:06
105,103,"“universitas kristen maranatha” OR ""universitas maranatha"" OR ""uk maranatha"" -site:*.maranatha.edu -site:kemdikbud.go.id -site:linkedin.com -site:twitter.com -site:instagram.com -site:lldikti4.or.id -site:facebook.com -site:tiktok.com -site:olx.co.id -site:slideshare.net -site:rumah123.com -site:tiket.com -site:expedia.co.id -site:traveloka.com -site:wikipedia.org -intitle:hotel",desktop,Browse Author Index,"Oct 22, 2023 — A B C D E F G H I J K L M N O P Q R S T U V W X Y Z All. G. Ginting, Seriwati, Desain Komunikasi Visual FSRD UK Maranatha (Indonesia) 1 - 1 of 1 Items.",16545,117,https://ejurnal.pps.ung.ac.id/index.php/paudhi/search/authors?searchInitial=G,ejurnal.pps.ung.ac.id,ung.ac.id,https://ejurnal.pps.ung.ac.id › authors,yes,FALSE,FALSE,FALSE,FALSE,FALSE,"Indonesia Sukasari, Bandung City, West Java",11/3/2023,14:06
106,104,"“universitas kristen maranatha” OR ""universitas maranatha"" OR ""uk maranatha"" -site:*.maranatha.edu -site:kemdikbud.go.id -site:linkedin.com -site:twitter.com -site:instagram.com -site:lldikti4.or.id -site:facebook.com -site:tiktok.com -site:olx.co.id -site:slideshare.net -site:rumah123.com -site:tiket.com -site:expedia.co.id -site:traveloka.com -site:wikipedia.org -intitle:hotel",desktop,10 Universitas di Bandung: Perguruan Tinggi Terbaik di 2023,"Oct 2, 2023 — 7. Universitas Kristen Maranatha. Universitas Kristen Maranatha adalah salah satu universitas di Bandung swasta yang menggabungkan iman Kristen dengan ...",16692,117,https://www.julo.co.id/blog/universitas-di-bandung,www.julo.co.id,julo.co.id,https://www.julo.co.id › blog › univ...,yes,FALSE,TRUE,FALSE,FALSE,FALSE,"Indonesia Sukasari, Bandung City, West Java",11/3/2023,14:06
107,105,"“universitas kristen maranatha” OR ""universitas maranatha"" OR ""uk maranatha"" -site:*.maranatha.edu -site:kemdikbud.go.id -site:linkedin.com -site:twitter.com -site:instagram.com -site:lldikti4.or.id -site:facebook.com -site:tiktok.com -site:olx.co.id -site:slideshare.net -site:rumah123.com -site:tiket.com -site:expedia.co.id -site:traveloka.com -site:wikipedia.org -intitle:hotel",desktop,UII Adakan Kuliah Umum soal Peluang Berkarir di Sektor ...,"1 day ago — Lalu, Universitas Trisakti, BINUS University, STHI Jentera, STIE YKPN Yogyakarta, UPN Veteran Jakarta, UK Petra, UK Maranatha, Universitas Muhammadyah ...",16839,117,https://news.ddtc.co.id/uii-adakan-kuliah-umum-soal-peluang-berkarir-di-sektor-perpajakan-1798282,news.ddtc.co.id,ddtc.co.id,https://news.ddtc.co.id › uii-adakan-...,yes,TRUE,TRUE,FALSE,FALSE,FALSE,"Indonesia Sukasari, Bandung City, West Java",11/3/2023,14:06
108,106,"“universitas kristen maranatha” OR ""universitas maranatha"" OR ""uk maranatha"" -site:*.maranatha.edu -site:kemdikbud.go.id -site:linkedin.com -site:twitter.com -site:instagram.com -site:lldikti4.or.id -site:facebook.com -site:tiktok.com -site:olx.co.id -site:slideshare.net -site:rumah123.com -site:tiket.com -site:expedia.co.id -site:traveloka.com -site:wikipedia.org -intitle:hotel",desktop,Project & Testimoni,"Oct 1, 2023 — Project & Testimoni ; Festival City Link. Produk yang digunakan : - Crystal coat ; Universitas Maranatha. Produk yang digunakan : - Attaboy Weatherguard ; Masjid ...",16985,117,https://iwpaint.com/en/testimonials/,iwpaint.com,iwpaint.com,https://iwpaint.com › testimonials,yes,FALSE,TRUE,FALSE,FALSE,FALSE,"Indonesia Sukasari, Bandung City, West Java",11/3/2023,14:06
109,107,"“universitas kristen maranatha” OR ""universitas maranatha"" OR ""uk maranatha"" -site:*.maranatha.edu -site:kemdikbud.go.id -site:linkedin.com -site:twitter.com -site:instagram.com -site:lldikti4.or.id -site:facebook.com -site:tiktok.com -site:olx.co.id -site:slideshare.net -site:rumah123.com -site:tiket.com -site:expedia.co.id -site:traveloka.com -site:wikipedia.org -intitle:hotel",desktop,Tanah hook strategis siap bangun setra duta Bandung utara,1 day ago — 7 Menit Ke Universitas Kristen Maranatha 9 Menit Ke POLBAN 10 Menit Gerbang Tol Pasteur 2 13 Menit Ke Apotek Generik Pesantren CARA BAYAR : CASH DIUTAMAKAN,17132,117,https://www.lamudi.co.id/tanah-hook-strategis-siap-bangun-setra-duta-bandun-169890831027.html,www.lamudi.co.id,lamudi.co.id,https://www.lamudi.co.id › tanah-h...,yes,FALSE,FALSE,FALSE,FALSE,FALSE,"Indonesia Sukasari, Bandung City, West Java",11/3/2023,14:06
110,108,"“universitas kristen maranatha” OR ""universitas maranatha"" OR ""uk maranatha"" -site:*.maranatha.edu -site:kemdikbud.go.id -site:linkedin.com -site:twitter.com -site:instagram.com -site:lldikti4.or.id -site:facebook.com -site:tiktok.com -site:olx.co.id -site:slideshare.net -site:rumah123.com -site:tiket.com -site:expedia.co.id -site:traveloka.com -site:wikipedia.org -intitle:hotel",desktop,Ganjar Pranowo Ajak Kalangan Muda Berpartisipasi dalam ...,"Oct 12, 2023 — Setelah dari Unpar, Ganjar langsung mengunjungi Universitas Kristen Maranatha yang berada di kawasan Jalan Surya Sumantri. Dalam acara tersebut Ganjar juga ...",17279,117,https://pasjabar.com/2023/10/12/ganjar-pranowo-ajak-kalangan-muda-berpartisipasi-dalam-pesta-demokrasi-2024/,pasjabar.com,pasjabar.com,https://pasjabar.com › 2023/10/12,yes,TRUE,TRUE,FALSE,FALSE,FALSE,"Indonesia Sukasari, Bandung City, West Java",11/3/2023,14:06
111,109,"“universitas kristen maranatha” OR ""universitas maranatha"" OR ""uk maranatha"" -site:*.maranatha.edu -site:kemdikbud.go.id -site:linkedin.com -site:twitter.com -site:instagram.com -site:lldikti4.or.id -site:facebook.com -site:tiktok.com -site:olx.co.id -site:slideshare.net -site:rumah123.com -site:tiket.com -site:expedia.co.id -site:traveloka.com -site:wikipedia.org -intitle:hotel",desktop,Ganjar: Pendidikan Kunci dalam Pemberantasan ...,"Oct 12, 2023 — Hal itu disampaikan Ganjar di hadapan ribuan mahasiswa ketika memberikan kuliah umum di Kampus Universitas Kristen Maranatha Bandung, Jawa Barat. 'Saya ...",17456,117,https://www.pdiperjuanganbali.id/berita/baca/4428,www.pdiperjuanganbali.id,pdiperjuanganbali.id,https://www.pdiperjuanganbali.id › ...,yes,TRUE,TRUE,FALSE,FALSE,FALSE,"Indonesia Sukasari, Bandung City, West Java",11/3/2023,14:06
