Position,Organic Position,Searchquery,Device,Title,Description,Pixeldistance from top,Snippet Pixel Height,URL,domain,Sitename,URL Preview,Custom Favicon,Title truncated,Description truncated,Has sitelinks,Has rich results,Has image,location,date,time
57,55,"“universitas kristen maranatha” OR ""universitas maranatha"" OR ""uk maranatha"" -site:*.maranatha.edu -site:kemdikbud.go.id -site:linkedin.com -site:twitter.com -site:instagram.com -site:lldikti4.or.id -site:facebook.com -site:tiktok.com -site:olx.co.id -site:slideshare.net -site:rumah123.com -site:tiket.com -site:expedia.co.id -site:traveloka.com -site:wikipedia.org -intitle:hotel",desktop,"Halim, Winda, Universitas Kristen Maranatha, Indonesia","6 days ago — Halim, Winda, Universitas Kristen Maranatha, Indonesia. Vol 15, No 1 (2022): ISSN 1693-2102 - Artikel Analysis of Drowsiness with Karolinska Sleepiness Scale ...",9348,117,http://jurnal.upnyk.ac.id/index.php/index/search/authors/view?firstName=Winda&middleName=&lastName=Halim&affiliation=Universitas%20Kristen%20Maranatha&country=ID,jurnal.upnyk.ac.id,upnyk.ac.id,http://jurnal.upnyk.ac.id › view,yes,FALSE,TRUE,FALSE,FALSE,FALSE,"Indonesia Sukasari, Bandung City, West Java",11/3/2023,14:06
58,56,"“universitas kristen maranatha” OR ""universitas maranatha"" OR ""uk maranatha"" -site:*.maranatha.edu -site:kemdikbud.go.id -site:linkedin.com -site:twitter.com -site:instagram.com -site:lldikti4.or.id -site:facebook.com -site:tiktok.com -site:olx.co.id -site:slideshare.net -site:rumah123.com -site:tiket.com -site:expedia.co.id -site:traveloka.com -site:wikipedia.org -intitle:hotel",desktop,"Entaskan Kemiskinan, Ganjar Programkan Satu Keluarga ...","Oct 11, 2023 — Hal itu disampaikan Ganjar di hadapan ribuan mahasiswa ketika memberikan kuliah umum di Universitas Kristen Maranatha Bandung, Rabu (11/10). Dalam kesempatan ...",9495,117,https://www.indopos.co.id/nasional/2023/10/11/entaskan-kemiskinan-ganjar-programkan-satu-keluarga-miskin-satu-sarjana/,www.indopos.co.id,indopos.co.id,https://www.indopos.co.id › nasional,yes,TRUE,TRUE,FALSE,FALSE,FALSE,"Indonesia Sukasari, Bandung City, West Java",11/3/2023,14:06
59,57,"“universitas kristen maranatha” OR ""universitas maranatha"" OR ""uk maranatha"" -site:*.maranatha.edu -site:kemdikbud.go.id -site:linkedin.com -site:twitter.com -site:instagram.com -site:lldikti4.or.id -site:facebook.com -site:tiktok.com -site:olx.co.id -site:slideshare.net -site:rumah123.com -site:tiket.com -site:expedia.co.id -site:traveloka.com -site:wikipedia.org -intitle:hotel",desktop,Author Details | KINERJA,"Oct 26, 2023 — Amanda, Verna Budi, Universitas Kristen Maranatha, Indonesia. KINERJA Vol. 26 No. 2 (2022): KINERJA - Articles The The Mediation Effect of Market ...",9641,117,https://ojs.uajy.ac.id/index.php/kinerja/search/authors/view?givenName=Verna%20Budi&familyName=Amanda&affiliation=Universitas%20Kristen%20Maranatha&country=ID&authorName=Amanda%2C%20Verna%20Budi,ojs.uajy.ac.id,uajy.ac.id,https://ojs.uajy.ac.id › kinerja › search › authors › view,yes,FALSE,TRUE,FALSE,FALSE,FALSE,"Indonesia Sukasari, Bandung City, West Java",11/3/2023,14:06
60,58,"“universitas kristen maranatha” OR ""universitas maranatha"" OR ""uk maranatha"" -site:*.maranatha.edu -site:kemdikbud.go.id -site:linkedin.com -site:twitter.com -site:instagram.com -site:lldikti4.or.id -site:facebook.com -site:tiktok.com -site:olx.co.id -site:slideshare.net -site:rumah123.com -site:tiket.com -site:expedia.co.id -site:traveloka.com -site:wikipedia.org -intitle:hotel",desktop,Ganjar Programkan Satu Keluarga Miskin Satu Sarjana,"Oct 11, 2023 — Hal itu ia sampaikan ketika memberikan kuliah umum di Universitas Kristen Maranatha Bandung, Rabu (11/10/2023). Dalam kesempatan itu, ia memaparkan ide dan ...",9788,117,https://lingkar.co/ganjar-programkan-satu-keluarga-miskin-satu-sarjana/,lingkar.co,lingkar.co,https://lingkar.co › ganjar-program...,yes,FALSE,TRUE,FALSE,FALSE,FALSE,"Indonesia Sukasari, Bandung City, West Java",11/3/2023,14:06
61,59,"“universitas kristen maranatha” OR ""universitas maranatha"" OR ""uk maranatha"" -site:*.maranatha.edu -site:kemdikbud.go.id -site:linkedin.com -site:twitter.com -site:instagram.com -site:lldikti4.or.id -site:facebook.com -site:tiktok.com -site:olx.co.id -site:slideshare.net -site:rumah123.com -site:tiket.com -site:expedia.co.id -site:traveloka.com -site:wikipedia.org -intitle:hotel",desktop,"Sambangi Universitas Kristen Maranatha, Ganjar Pranowo ...","Oct 11, 2023 — Sambangi Universitas Kristen Maranatha, Ganjar Pranowo Kenalkan Program Gaspol ... Universitas Maranatha, Ganjar Ingatkan Perempuan Tak Menikah Dini. Related ...",9965,117,https://halloindo.com/okezone/sambangi-universitas-kristen-maranatha-ganjar-pranowo-kenalkan-program-gaspol,halloindo.com,halloindo.com,https://halloindo.com › okezone › s...,yes,TRUE,TRUE,FALSE,FALSE,FALSE,"Indonesia Sukasari, Bandung City, West Java",11/3/2023,14:06
62,60,"“universitas kristen maranatha” OR ""universitas maranatha"" OR ""uk maranatha"" -site:*.maranatha.edu -site:kemdikbud.go.id -site:linkedin.com -site:twitter.com -site:instagram.com -site:lldikti4.or.id -site:facebook.com -site:tiktok.com -site:olx.co.id -site:slideshare.net -site:rumah123.com -site:tiket.com -site:expedia.co.id -site:traveloka.com -site:wikipedia.org -intitle:hotel",desktop,"UNPAR Lolos Seleksi Internal LLDIKTI IV, Ikuti Anugerah ...",5 days ago — Peringkat 2 Universitas Katolik Parahyangan; Peringkat 3 Universitas Widyatama; Peringkat Harapan 1 Universitas Kristen Maranatha; Peringkat Harapan 2 Institut ...,10112,117,https://unpar.ac.id/unpar-lolos-seleksi-internal-lldikti-iv-ikuti-anugerah-kerja-sama-internasional-diktiristek-tingkat-nasional/,unpar.ac.id,unpar.ac.id,https://unpar.ac.id › unpar-lolos-sel...,yes,TRUE,TRUE,FALSE,FALSE,FALSE,"Indonesia Sukasari, Bandung City, West Java",11/3/2023,14:06
63,61,"“universitas kristen maranatha” OR ""universitas maranatha"" OR ""uk maranatha"" -site:*.maranatha.edu -site:kemdikbud.go.id -site:linkedin.com -site:twitter.com -site:instagram.com -site:lldikti4.or.id -site:facebook.com -site:tiktok.com -site:olx.co.id -site:slideshare.net -site:rumah123.com -site:tiket.com -site:expedia.co.id -site:traveloka.com -site:wikipedia.org -intitle:hotel",desktop,Editorial Team,"6 days ago — I Nyoman Agus Wijaya Mail · https://scholar.google.com/citations?hl=id&user=Arl_VZYAAAAJ (Sopus Id:57219876327), Universitas Maranatha Bandung, Indonesia.",10259,117,http://ejurnal.mercubuana-yogya.ac.id/index.php/akuntansi/about/editorialTeamBio/21203,ejurnal.mercubuana-yogya.ac.id,mercubuana-yogya.ac.id,http://ejurnal.mercubuana-yogya.ac.id › ...,yes,FALSE,FALSE,FALSE,FALSE,FALSE,"Indonesia Sukasari, Bandung City, West Java",11/3/2023,14:06
64,62,"“universitas kristen maranatha” OR ""universitas maranatha"" OR ""uk maranatha"" -site:*.maranatha.edu -site:kemdikbud.go.id -site:linkedin.com -site:twitter.com -site:instagram.com -site:lldikti4.or.id -site:facebook.com -site:tiktok.com -site:olx.co.id -site:slideshare.net -site:rumah123.com -site:tiket.com -site:expedia.co.id -site:traveloka.com -site:wikipedia.org -intitle:hotel",desktop,ANALISIS KUALITAS LAPORAN KEUANGAN DAN ...,"13 hours ago — Chindy Larasati Anamuli Universitas Kristen Maranatha, Bandung; I Nyoman Agus Wijaya Nyoman Agus Wijaya Universitas Kristen Maranatha, Bandung. DOI: https ...",10406,117,https://journal.stiemb.ac.id/index.php/mea/article/view/3443,journal.stiemb.ac.id,stiemb.ac.id,https://journal.stiemb.ac.id › view,yes,TRUE,TRUE,FALSE,FALSE,FALSE,"Indonesia Sukasari, Bandung City, West Java",11/3/2023,14:06
65,63,"“universitas kristen maranatha” OR ""universitas maranatha"" OR ""uk maranatha"" -site:*.maranatha.edu -site:kemdikbud.go.id -site:linkedin.com -site:twitter.com -site:instagram.com -site:lldikti4.or.id -site:facebook.com -site:tiktok.com -site:olx.co.id -site:slideshare.net -site:rumah123.com -site:tiket.com -site:expedia.co.id -site:traveloka.com -site:wikipedia.org -intitle:hotel",desktop,The Investment Model Pada Pasangan Suami Istri di Kota ...,"Oct 9, 2023 — At: Universitas Kristen Maranatha. Authors: Irene Edwina at Universitas Kristen Maranatha. Irene Edwina · Universitas Kristen Maranatha · yuni ...",10553,117,https://www.researchgate.net/publication/346017906_The_Investment_Model_Pada_Pasangan_Suami_Istri_di_Kota_Bandung,www.researchgate.net,researchgate.net,https://www.researchgate.net › 346...,yes,TRUE,TRUE,FALSE,FALSE,FALSE,"Indonesia Sukasari, Bandung City, West Java",11/3/2023,14:06
66,64,"“universitas kristen maranatha” OR ""universitas maranatha"" OR ""uk maranatha"" -site:*.maranatha.edu -site:kemdikbud.go.id -site:linkedin.com -site:twitter.com -site:instagram.com -site:lldikti4.or.id -site:facebook.com -site:tiktok.com -site:olx.co.id -site:slideshare.net -site:rumah123.com -site:tiket.com -site:expedia.co.id -site:traveloka.com -site:wikipedia.org -intitle:hotel",desktop,"Berantas Kemiskinan, Ganjar Canangkan Program Satu ...","Oct 12, 2023 — Hal itu disampaikan Ganjar di hadapan ribuan mahasiswa ketika memberikan kuliah umum di Kampus Universitas Kristen Maranatha Bandung, Jawa Barat. 'Saya ...",10699,117,https://www.inilah.com/berantas-kemiskinan-ganjar-canangkan-program-satu-keluarga-miskin-satu-sarjana,www.inilah.com,inilah.com,https://www.inilah.com › berantas-k...,yes,TRUE,TRUE,FALSE,FALSE,FALSE,"Indonesia Sukasari, Bandung City, West Java",11/3/2023,14:06
67,65,"“universitas kristen maranatha” OR ""universitas maranatha"" OR ""uk maranatha"" -site:*.maranatha.edu -site:kemdikbud.go.id -site:linkedin.com -site:twitter.com -site:instagram.com -site:lldikti4.or.id -site:facebook.com -site:tiktok.com -site:olx.co.id -site:slideshare.net -site:rumah123.com -site:tiket.com -site:expedia.co.id -site:traveloka.com -site:wikipedia.org -intitle:hotel",desktop,"Ganjar: Tanpa Pemimpin Bersih, Pemberantasan Korupsi ...","Oct 11, 2023 — Hal itu ditegaskan bacapres 2024, Ganjar Pranowo saat memberikan kuliah umum di Universitas Kristen Maranatha Bandung, Rabu (11/10). Di hadapan ribuan ...",10846,117,https://www.mnctrijaya.com/news/detail/62713/ganjar-tanpa-pemimpin-bersih-pemberantasan-korupsi-sulit-terwujud,www.mnctrijaya.com,mnctrijaya.com,https://www.mnctrijaya.com › detail,yes,TRUE,TRUE,FALSE,FALSE,FALSE,"Indonesia Sukasari, Bandung City, West Java",11/3/2023,14:06
68,66,"“universitas kristen maranatha” OR ""universitas maranatha"" OR ""uk maranatha"" -site:*.maranatha.edu -site:kemdikbud.go.id -site:linkedin.com -site:twitter.com -site:instagram.com -site:lldikti4.or.id -site:facebook.com -site:tiktok.com -site:olx.co.id -site:slideshare.net -site:rumah123.com -site:tiket.com -site:expedia.co.id -site:traveloka.com -site:wikipedia.org -intitle:hotel",desktop,"Di depan ribuan mahasiswa, Ganjar tegaskan bahwa ...","Oct 11, 2023 — Ganjar Pranowo saat memberikan kuliah umum di Kampus Universitas Kristen Maranatha ... Universitas Maranatha, Bandung Jawa Barat, Rabu (11/10/2023). Dalam ...",10993,117,https://popularitas.com/berita/didepan-ribuan-mahasiswa-ganjar-tegaskan-bahwa-pendidikan-adalalah-kunci-pengentasan-kemiskinan-di-indonesia/,popularitas.com,popularitas.com,https://popularitas.com › News,yes,TRUE,TRUE,FALSE,FALSE,FALSE,"Indonesia Sukasari, Bandung City, West Java",11/3/2023,14:06
69,67,"“universitas kristen maranatha” OR ""universitas maranatha"" OR ""uk maranatha"" -site:*.maranatha.edu -site:kemdikbud.go.id -site:linkedin.com -site:twitter.com -site:instagram.com -site:lldikti4.or.id -site:facebook.com -site:tiktok.com -site:olx.co.id -site:slideshare.net -site:rumah123.com -site:tiket.com -site:expedia.co.id -site:traveloka.com -site:wikipedia.org -intitle:hotel",desktop,Data lengkap profil dosen SHELLY KURNIAWAN ...,"Oct 24, 2023 — No, Tahun Ajaran, Nama Matakuliah, Kelas, Perguruan Tinggi. 1. Genap 2018 · ME216 - HUKUM BISNIS & HUKUM PERPAJAKAN · D · Universitas Kristen Maranatha.",11140,117,https://profilpelajar.com/profil/dosen/SHELLY-KURNIAWAN/862abd27a466a6e9084b69adccc5d2c5c34a60ee,profilpelajar.com,profilpelajar.com,https://profilpelajar.com › profil › S...,yes,TRUE,FALSE,FALSE,FALSE,FALSE,"Indonesia Sukasari, Bandung City, West Java",11/3/2023,14:06
70,68,"“universitas kristen maranatha” OR ""universitas maranatha"" OR ""uk maranatha"" -site:*.maranatha.edu -site:kemdikbud.go.id -site:linkedin.com -site:twitter.com -site:instagram.com -site:lldikti4.or.id -site:facebook.com -site:tiktok.com -site:olx.co.id -site:slideshare.net -site:rumah123.com -site:tiket.com -site:expedia.co.id -site:traveloka.com -site:wikipedia.org -intitle:hotel",desktop,People,"Oct 6, 2023 — ... Universitas Kristen Maranatha, Indonesia. Robertgie Laprodes Piañar, Leyte Normal University, Philippines. Agustina Kusuma Dewi, Institut Teknologi Nasional ...",11286,117,https://e-journal.usd.ac.id/index.php/IJHS/about/displayMembership/37,e-journal.usd.ac.id,usd.ac.id,https://e-journal.usd.ac.id › about › displayMembership,yes,FALSE,TRUE,FALSE,FALSE,FALSE,"Indonesia Sukasari, Bandung City, West Java",11/3/2023,14:06
71,69,"“universitas kristen maranatha” OR ""universitas maranatha"" OR ""uk maranatha"" -site:*.maranatha.edu -site:kemdikbud.go.id -site:linkedin.com -site:twitter.com -site:instagram.com -site:lldikti4.or.id -site:facebook.com -site:tiktok.com -site:olx.co.id -site:slideshare.net -site:rumah123.com -site:tiket.com -site:expedia.co.id -site:traveloka.com -site:wikipedia.org -intitle:hotel",desktop,FKG Moestopo Ramaikan Kegiatan International Dental ...,"Oct 25, 2023 — ... Universitas Kristen Maranatha, Universitas Baiturrahmah, Universitas Andalas, University of Malaya, Universitas Padjadjaran, dan Universitas Gadjah Mada.",11464,117,https://moestopo.ac.id/blog/fkg-moestopo-ramaikan-kegiatan-international-dental-student-summer-camp-in-bali-2023,moestopo.ac.id,moestopo.ac.id,https://moestopo.ac.id › blog › fkg-...,yes,TRUE,TRUE,FALSE,FALSE,FALSE,"Indonesia Sukasari, Bandung City, West Java",11/3/2023,14:06
72,70,"“universitas kristen maranatha” OR ""universitas maranatha"" OR ""uk maranatha"" -site:*.maranatha.edu -site:kemdikbud.go.id -site:linkedin.com -site:twitter.com -site:instagram.com -site:lldikti4.or.id -site:facebook.com -site:tiktok.com -site:olx.co.id -site:slideshare.net -site:rumah123.com -site:tiket.com -site:expedia.co.id -site:traveloka.com -site:wikipedia.org -intitle:hotel",desktop,Ganjar Gagas Program Satu Keluarga Miskin Satu Sarjana,"Oct 12, 2023 — Capres PDIP Ganjar saat memberikan kuliah umum di Universitas Kristen Maranatha Bandung, Rabu 11 Oktober. Bagikan: BANDUNG – Bakal calon presiden 2024 ...",11610,117,https://voi.id/berita/318964/ganjar-gagas-program-satu-keluarga-miskin-satu-sarjana,voi.id,voi.id,https://voi.id › Aktual › Berita,yes,FALSE,TRUE,FALSE,FALSE,FALSE,"Indonesia Sukasari, Bandung City, West Java",11/3/2023,14:06
73,71,"“universitas kristen maranatha” OR ""universitas maranatha"" OR ""uk maranatha"" -site:*.maranatha.edu -site:kemdikbud.go.id -site:linkedin.com -site:twitter.com -site:instagram.com -site:lldikti4.or.id -site:facebook.com -site:tiktok.com -site:olx.co.id -site:slideshare.net -site:rumah123.com -site:tiket.com -site:expedia.co.id -site:traveloka.com -site:wikipedia.org -intitle:hotel",desktop,"Beasiswa OSCMedcom.id ditutup,pendaftar nyaris 20 ribu ...","2 days ago — ... Universitas Kristen Maranatha, dan Universitas Atma Jaya Yogyakarta. Sponsored. Kemudian, Universitas Islam Indonesia, Universitas Gajayana, Universitas ...",11757,117,https://www.alinea.id/gaya-hidup/beasiswa-oscmedcom-id-ditutup-pendaftar-nyaris-20-ribu-orang-b2iaz9PeG,www.alinea.id,alinea.id,https://www.alinea.id › gaya-hidup,yes,TRUE,TRUE,FALSE,FALSE,FALSE,"Indonesia Sukasari, Bandung City, West Java",11/3/2023,14:06
74,72,"“universitas kristen maranatha” OR ""universitas maranatha"" OR ""uk maranatha"" -site:*.maranatha.edu -site:kemdikbud.go.id -site:linkedin.com -site:twitter.com -site:instagram.com -site:lldikti4.or.id -site:facebook.com -site:tiktok.com -site:olx.co.id -site:slideshare.net -site:rumah123.com -site:tiket.com -site:expedia.co.id -site:traveloka.com -site:wikipedia.org -intitle:hotel",desktop,Fakultas Kedokteran Maranatha - Homecare24,"5 days ago — Selamat datang di artikel kami kali ini! Pada kesempatan ini, kami akan membahas tentang Fakultas Kedokteran Universitas Kristen Maranatha (FK UKM) dan.",11904,117,https://homecare24.id/fakultas-kedokteran-maranatha/,homecare24.id,homecare24.id,https://homecare24.id › fakultas-ke...,yes,FALSE,FALSE,FALSE,FALSE,FALSE,"Indonesia Sukasari, Bandung City, West Java",11/3/2023,14:06
75,73,"“universitas kristen maranatha” OR ""universitas maranatha"" OR ""uk maranatha"" -site:*.maranatha.edu -site:kemdikbud.go.id -site:linkedin.com -site:twitter.com -site:instagram.com -site:lldikti4.or.id -site:facebook.com -site:tiktok.com -site:olx.co.id -site:slideshare.net -site:rumah123.com -site:tiket.com -site:expedia.co.id -site:traveloka.com -site:wikipedia.org -intitle:hotel",desktop,Karya Mahasiswa Prodi D-4 Desain Mode Kriya Batik ...,"Oct 23, 2023 — ... Universitas Kristen Maranatha. Prestasi yang ditorehkan oleh Icha Olivia dan rekan-rekan menjadi bukti bahwa produk yang dihasilkan oleh mahasiswa atau ...",12051,117,https://isi.ac.id/karya-mahasiswa-prodi-d-4-desain-mode-kriya-batik-ditampilkan-dalam-jmfw-2023/?utm_source=rss&utm_medium=rss&utm_campaign=karya-mahasiswa-prodi-d-4-desain-mode-kriya-batik-ditampilkan-dalam-jmfw-2023,isi.ac.id,isi.ac.id,https://isi.ac.id › karya-mahasiswa-p...,yes,TRUE,TRUE,FALSE,FALSE,FALSE,"Indonesia Sukasari, Bandung City, West Java",11/3/2023,14:06
76,74,"“universitas kristen maranatha” OR ""universitas maranatha"" OR ""uk maranatha"" -site:*.maranatha.edu -site:kemdikbud.go.id -site:linkedin.com -site:twitter.com -site:instagram.com -site:lldikti4.or.id -site:facebook.com -site:tiktok.com -site:olx.co.id -site:slideshare.net -site:rumah123.com -site:tiket.com -site:expedia.co.id -site:traveloka.com -site:wikipedia.org -intitle:hotel",desktop,"Upaya Entaskan Kemiskinan, Ganjar Programkan Satu ...","Oct 12, 2023 — Web Ganjar di hadapan ribuan mahasiswa ketika memberikan kuliah umum di Universitas Kristen Maranatha Bandung, Rabu (11/10/2023). REPUBLIKA.CO.ID, BANDUNG – ...",12197,117,https://news.republika.co.id/berita/s2di1r456/upaya-entaskan-kemiskinan-ganjar-programkan-satu-keluarga-miskin-satu-sarjana,news.republika.co.id,republika.co.id,https://news.republika.co.id › berita,yes,TRUE,TRUE,FALSE,FALSE,FALSE,"Indonesia Sukasari, Bandung City, West Java",11/3/2023,14:06
77,75,"“universitas kristen maranatha” OR ""universitas maranatha"" OR ""uk maranatha"" -site:*.maranatha.edu -site:kemdikbud.go.id -site:linkedin.com -site:twitter.com -site:instagram.com -site:lldikti4.or.id -site:facebook.com -site:tiktok.com -site:olx.co.id -site:slideshare.net -site:rumah123.com -site:tiket.com -site:expedia.co.id -site:traveloka.com -site:wikipedia.org -intitle:hotel",desktop,Business Seminar Series #4 - Telkom University,"Oct 15, 2023 — ... Universitas Kristen Maranatha, Universitan Katolik Darma Cendika dan banyak lainnya. Terimakasih untuk antusias dari para peserta yang telah hadir pada ...",12344,117,https://mm.telkomuniversity.ac.id/id/business-seminar-series-4-3/,mm.telkomuniversity.ac.id,telkomuniversity.ac.id,https://mm.telkomuniversity.ac.id › ...,yes,FALSE,TRUE,FALSE,FALSE,FALSE,"Indonesia Sukasari, Bandung City, West Java",11/3/2023,14:06
78,76,"“universitas kristen maranatha” OR ""universitas maranatha"" OR ""uk maranatha"" -site:*.maranatha.edu -site:kemdikbud.go.id -site:linkedin.com -site:twitter.com -site:instagram.com -site:lldikti4.or.id -site:facebook.com -site:tiktok.com -site:olx.co.id -site:slideshare.net -site:rumah123.com -site:tiket.com -site:expedia.co.id -site:traveloka.com -site:wikipedia.org -intitle:hotel",desktop,"dr. Yulius Setiadi, Sp.PD | Rumah Sakit Grha","Oct 19, 2023 — Background Information · 2010. : Kedokteran Umum di FK Universitas Maranatha · 2019. : Dokter Spesialis Penyakit Dalam di FK Universitas Sam Ratulangi.",12491,117,https://grhakedoya.com/en/doctors/dr-yulius-setiadi-sppd,grhakedoya.com,grhakedoya.com,https://grhakedoya.com › doctors,yes,FALSE,FALSE,FALSE,FALSE,FALSE,"Indonesia Sukasari, Bandung City, West Java",11/3/2023,14:06
79,77,"“universitas kristen maranatha” OR ""universitas maranatha"" OR ""uk maranatha"" -site:*.maranatha.edu -site:kemdikbud.go.id -site:linkedin.com -site:twitter.com -site:instagram.com -site:lldikti4.or.id -site:facebook.com -site:tiktok.com -site:olx.co.id -site:slideshare.net -site:rumah123.com -site:tiket.com -site:expedia.co.id -site:traveloka.com -site:wikipedia.org -intitle:hotel",desktop,Berikut Biaya Kuliah Jurusan Kedokteran di 5 Kampus ...,"Oct 14, 2023 — Fakultas Kedokteran Universitas Kristen Maranatha adalah FK swasta pertama yang ada di Bandung. Fakultas Kedokteran di kampus swasta ini berfokus pada ...",12638,117,https://www.jatitimes.com/pendidikan/553075814/berikut-biaya-kuliah-jurusan-kedokteran-di-5-kampus-swasta-akreditasi-a-oleh-ban-pt-ada-incaran-kalian?page=4,www.jatitimes.com,jatitimes.com,https://www.jatitimes.com › berikut-...,yes,TRUE,TRUE,FALSE,FALSE,FALSE,"Indonesia Sukasari, Bandung City, West Java",11/3/2023,14:06
80,78,"“universitas kristen maranatha” OR ""universitas maranatha"" OR ""uk maranatha"" -site:*.maranatha.edu -site:kemdikbud.go.id -site:linkedin.com -site:twitter.com -site:instagram.com -site:lldikti4.or.id -site:facebook.com -site:tiktok.com -site:olx.co.id -site:slideshare.net -site:rumah123.com -site:tiket.com -site:expedia.co.id -site:traveloka.com -site:wikipedia.org -intitle:hotel",desktop,Cari | Aksiologiya: Jurnal Pengabdian Kepada Masyarakat,"Oct 13, 2023 — (1) Universitas Kristen Maranatha ,. (2) Universitas Kristen Maranatha ,. (3) Universitas Kristen Maranatha ,. (4) Universitas Kristen Maranatha ,. (5) ...",12784,117,https://journal.um-surabaya.ac.id/Axiologiya/search/index?query=pengabdian%20masyarakat&searchJournal=16&authors=&title=&abstract=&galleyFullText=&discipline=&subject=&type=&coverage=&indexTerms=&dateFromMonth=&dateFromDay=&dateFromYear=&dateToMonth=&dateToDay=&dateToYear=&orderBy=score&orderDir=desc&searchPage=7,journal.um-surabaya.ac.id,um-surabaya.ac.id,https://journal.um-surabaya.ac.id › s...,yes,FALSE,TRUE,FALSE,FALSE,FALSE,"Indonesia Sukasari, Bandung City, West Java",11/3/2023,14:06
81,79,"“universitas kristen maranatha” OR ""universitas maranatha"" OR ""uk maranatha"" -site:*.maranatha.edu -site:kemdikbud.go.id -site:linkedin.com -site:twitter.com -site:instagram.com -site:lldikti4.or.id -site:facebook.com -site:tiktok.com -site:olx.co.id -site:slideshare.net -site:rumah123.com -site:tiket.com -site:expedia.co.id -site:traveloka.com -site:wikipedia.org -intitle:hotel",desktop,Eva Gustiana,"4 days ago — Psikologi, Universitas Sarjanawiyata Tamansiswa (2006). S2 Psikologi Profesi, Universitas Kristen Maranatha (2014). Email eva_psikologi@upmk.ac.id. Informasi.",12962,117,http://upmk.ac.id/profile/page/eva.gustiana.html,upmk.ac.id,upmk.ac.id,http://upmk.ac.id › profile › page,yes,FALSE,FALSE,FALSE,FALSE,FALSE,"Indonesia Sukasari, Bandung City, West Java",11/3/2023,14:06
82,80,"“universitas kristen maranatha” OR ""universitas maranatha"" OR ""uk maranatha"" -site:*.maranatha.edu -site:kemdikbud.go.id -site:linkedin.com -site:twitter.com -site:instagram.com -site:lldikti4.or.id -site:facebook.com -site:tiktok.com -site:olx.co.id -site:slideshare.net -site:rumah123.com -site:tiket.com -site:expedia.co.id -site:traveloka.com -site:wikipedia.org -intitle:hotel",desktop,"Beri Kuliah Umum di Unkris Maranatha Bandung, Ganjar ...","Oct 17, 2023 — Dalam pernyataannya saat memberikan kuliah umum di Kampus Universitas Kristen Maranatha Bandung, Jawa Barat, Ganjar berjanji akan menggratiskan biaya sekolah ...",13108,117,https://www.tajukflores.com/beri-kuliah-umum-di-unkris-maranatha-bandung-ganjar-janji-gratiskan-biaya-sekolah-dari-paud-hingga-sma/,www.tajukflores.com,tajukflores.com,https://www.tajukflores.com › beri-...,yes,TRUE,TRUE,FALSE,FALSE,FALSE,"Indonesia Sukasari, Bandung City, West Java",11/3/2023,14:06
83,81,"“universitas kristen maranatha” OR ""universitas maranatha"" OR ""uk maranatha"" -site:*.maranatha.edu -site:kemdikbud.go.id -site:linkedin.com -site:twitter.com -site:instagram.com -site:lldikti4.or.id -site:facebook.com -site:tiktok.com -site:olx.co.id -site:slideshare.net -site:rumah123.com -site:tiket.com -site:expedia.co.id -site:traveloka.com -site:wikipedia.org -intitle:hotel",desktop,Berikut Daftar Universitas Terbaik di Kota Bandung versi ...,1 day ago — Universitas Kristen Maranatha Peringkat #66 di Indonesia Peringkat #1451 di Asia Didirikan pada tahun 1965. Halaman: 1 · 2 · 3 · Selanjutnya. Editor: Nabilah ...,13255,117,https://www.klikpendidikan.id/pendidikan/35810727560/berikut-daftar-universitas-terbaik-di-kota-bandung-versi-edurank-calon-mahasiswa-2024-wajib-tahu,www.klikpendidikan.id,klikpendidikan.id,https://www.klikpendidikan.id › ber...,yes,TRUE,TRUE,FALSE,FALSE,FALSE,"Indonesia Sukasari, Bandung City, West Java",11/3/2023,14:06
